{
  "schemaVersion": 1,
  "id": "ps2-network-adapter",
  "type": "history",
  "contentVersion": 1,
  "status": "published",
  "publishedAt": "2002-01-01T00:00:00Z",
  "updatedAt": "2026-08-08T00:00:00Z",
  "eventDate": "2002",
  "datePrecision": "year",
  "categories": [
    "ps2-history"
  ],
  "tags": [
    "playstation-2",
    "service"
  ],
  "relatedProductIds": [
    "ps2"
  ],
  "featured": true,
  "priority": 0,
  "canonicalUrl": "https://en.wikipedia.org/wiki/PlayStation_2_Expansion_Bay",
  "sources": [
    {
      "title": "PlayStation 2 Expansion Bay",
      "publisher": "Wikipedia",
      "url": "https://en.wikipedia.org/wiki/PlayStation_2_Expansion_Bay",
      "publishedAt": "2002"
    }
  ],
  "heroAssetId": "history-ps2-network-adapter-hero",
  "assets": [
    {
      "assetId": "history-ps2-network-adapter-hero",
      "variants": {
        "thumbnail": {
          "path": "assets/history/console/thumbnail.webp",
          "width": 640,
          "height": 360
        },
        "display": {
          "path": "assets/history/console/display.webp",
          "width": 1280,
          "height": 720
        }
      },
      "rights": {
        "creator": "Evan-Amos",
        "sourceUrl": "https://commons.wikimedia.org/wiki/File:Sony-PlayStation-2-70001-Console-BL.jpg",
        "licenseId": "CC0-1.0",
        "attribution": "Image by Evan-Amos, licensed under CC0-1.0. Resized and converted to WebP for EmuCore - Hub.",
        "downloadAllowed": true,
        "licenseUrl": "https://creativecommons.org/publicdomain/zero/1.0/"
      }
    }
  ]
}
