{
  "schemaVersion": 1,
  "id": "tune-touchscreen-opacity-and-size-for-readability",
  "type": "manuals",
  "contentVersion": 1,
  "status": "published",
  "publishedAt": "2026-08-09T00:00:00Z",
  "updatedAt": "2026-08-09T00:00:00Z",
  "categories": [
    "emucorex",
    "controllers",
    "touchscreen"
  ],
  "tags": [
    "touchscreen",
    "opacity",
    "control-size",
    "readability"
  ],
  "relatedProductIds": [
    "emucorex",
    "pcsx2"
  ],
  "featured": false,
  "priority": 0,
  "canonicalUrl": "https://developer.android.com/games/sdk/game-controller/testing_controller",
  "sources": [
    {
      "id": "android-controller-testing",
      "title": "Test controller support",
      "publisher": "Android Developers",
      "url": "https://developer.android.com/games/sdk/game-controller/testing_controller"
    },
    {
      "id": "android-controller-events",
      "title": "Support game controllers",
      "publisher": "Android Developers",
      "url": "https://developer.android.com/develop/ui/views/touch-and-input/game-controllers"
    }
  ],
  "heroAssetId": "tune-touchscreen-opacity-and-size-for-readability-hero",
  "assets": [
    {
      "assetId": "tune-touchscreen-opacity-and-size-for-readability-hero",
      "variants": {
        "thumbnail": {
          "path": "assets/manuals/tune-touchscreen-opacity-and-size-for-readability/thumbnail.webp",
          "width": 640,
          "height": 360
        },
        "display": {
          "path": "assets/manuals/tune-touchscreen-opacity-and-size-for-readability/display.webp",
          "width": 1280,
          "height": 720
        }
      },
      "rights": {
        "creator": "Santeri Viinamäki",
        "sourceUrl": "https://commons.wikimedia.org/wiki/File:Playing_with_smartphone.jpg",
        "licenseId": "CC-BY-SA-4.0",
        "licenseUrl": "https://creativecommons.org/licenses/by-sa/4.0/",
        "attribution": "Playing with smartphone by Santeri Viinamäki, licensed under CC BY-SA 4.0. Cropped, resized, and converted to WebP for EmuCore - Hub.",
        "modified": true,
        "downloadAllowed": true
      }
    }
  ]
}
