{
  "schemaVersion": 1,
  "id": "authorize-a-library-folder-after-an-android-update",
  "type": "manuals",
  "contentVersion": 1,
  "status": "published",
  "publishedAt": "2026-08-09T00:00:00Z",
  "updatedAt": "2026-08-09T00:00:00Z",
  "categories": [
    "emucorex",
    "library",
    "android"
  ],
  "tags": [
    "storage-access-framework",
    "folder-permission",
    "library-recovery",
    "android-update"
  ],
  "relatedProductIds": [
    "emucorex",
    "pcsx2"
  ],
  "featured": false,
  "priority": 0,
  "canonicalUrl": "https://developer.android.com/guide/topics/providers/document-provider",
  "sources": [
    {
      "id": "android-saf",
      "title": "Open files using the Storage Access Framework",
      "publisher": "Android Developers",
      "url": "https://developer.android.com/guide/topics/providers/document-provider",
      "publishedAt": "2026-08-09T00:00:00Z"
    },
    {
      "id": "android-shared-files",
      "title": "Access documents and other files from shared storage",
      "publisher": "Android Developers",
      "url": "https://developer.android.com/training/data-storage/shared/documents-files",
      "publishedAt": "2026-08-09T00:00:00Z"
    }
  ],
  "heroAssetId": "authorize-a-library-folder-after-an-android-update-hero",
  "assets": [
    {
      "assetId": "authorize-a-library-folder-after-an-android-update-hero",
      "variants": {
        "thumbnail": {
          "path": "assets/manuals/authorize-a-library-folder-after-an-android-update/thumbnail.webp",
          "width": 640,
          "height": 360
        },
        "display": {
          "path": "assets/manuals/authorize-a-library-folder-after-an-android-update/display.webp",
          "width": 1280,
          "height": 720
        }
      },
      "rights": {
        "creator": "Android Developers",
        "sourceUrl": "https://developer.android.com/guide/topics/providers/document-provider",
        "licenseId": "CC BY 2.5",
        "licenseUrl": "https://creativecommons.org/licenses/by/2.5/",
        "attribution": "Screenshot of the Android Developers Storage Access Framework documentation, Android Developers, licensed under CC BY 2.5. Cropped, resized, and converted to WebP for EmuCore - Hub.",
        "modified": true,
        "downloadAllowed": true
      }
    }
  ]
}
