{
  "schemaVersion": 1,
  "id": "ace-combat-5-wingman-storytelling",
  "type": "history",
  "contentVersion": 1,
  "status": "published",
  "publishedAt": "2026-09-26T00:00:00Z",
  "updatedAt": "2026-09-26T00:00:00Z",
  "eventDate": "2004-10-21",
  "datePrecision": "day",
  "categories": [
    "ps2-history",
    "games"
  ],
  "tags": [
    "ace-combat-5",
    "wardog-squadron",
    "flight-combat",
    "playstation-2"
  ],
  "relatedProductIds": [
    "ps2"
  ],
  "featured": false,
  "priority": 0,
  "canonicalUrl": "https://acecombat.jp/en/product/",
  "sources": [
    {
      "id": "bandai-ace-product",
      "title": "ACE COMBAT series product history",
      "publisher": "Bandai Namco Entertainment",
      "url": "https://acecombat.jp/en/product/"
    },
    {
      "id": "sony-ac5-release",
      "title": "Sony Interactive company timeline: PlayStation 2 era",
      "publisher": "Sony Interactive Entertainment",
      "url": "https://sonyinteractive.com/en/our-company/expanded-company-timeline/"
    }
  ],
  "heroAssetId": "ace-combat-5-wingman-storytelling-hero",
  "assets": [
    {
      "assetId": "ace-combat-5-wingman-storytelling-hero",
      "variants": {
        "thumbnail": {
          "path": "assets/history/ace-combat-5-wingman-storytelling/thumbnail.webp",
          "width": 640,
          "height": 360
        },
        "display": {
          "path": "assets/history/ace-combat-5-wingman-storytelling/display.webp",
          "width": 1280,
          "height": 720
        }
      },
      "rights": {
        "creator": "John Kraus Photos",
        "sourceUrl": "https://commons.wikimedia.org/wiki/File:Jet_Formation_1.jpg",
        "licenseId": "CC0-1.0",
        "licenseUrl": "https://creativecommons.org/publicdomain/zero/1.0/deed.en",
        "attribution": "Jet Formation 1.jpg by John Kraus Photos, CC0. Resized and letterboxed for EmuCore - Hub. Source: https://commons.wikimedia.org/wiki/File:Jet_Formation_1.jpg.",
        "modified": true,
        "downloadAllowed": true
      }
    }
  ]
}
