{
  "schemaVersion": 1,
  "id": "build-a-graphics-regression-test-scene",
  "type": "manuals",
  "contentVersion": 1,
  "status": "published",
  "publishedAt": "2026-08-09T00:00:00Z",
  "updatedAt": "2026-08-09T00:00:00Z",
  "categories": [
    "emucorex",
    "graphics",
    "regression"
  ],
  "tags": [
    "test-scene",
    "baseline",
    "driver-update",
    "bisect"
  ],
  "relatedProductIds": [
    "emucorex",
    "pcsx2"
  ],
  "featured": false,
  "priority": 0,
  "canonicalUrl": "https://pcsx2.net/docs/troubleshooting/identify/",
  "sources": [
    {
      "id": "pcsx2-identify",
      "title": "How to Identify an Issue",
      "publisher": "PCSX2",
      "url": "https://pcsx2.net/docs/troubleshooting/identify/"
    },
    {
      "id": "pcsx2-runner",
      "title": "GS Dump Runner",
      "publisher": "PCSX2",
      "url": "https://pcsx2.net/docs/advanced/gsdumprunner/"
    }
  ],
  "heroAssetId": "build-a-graphics-regression-test-scene-hero",
  "assets": [
    {
      "assetId": "build-a-graphics-regression-test-scene-hero",
      "variants": {
        "thumbnail": {
          "path": "assets/manuals/build-a-graphics-regression-test-scene/thumbnail.webp",
          "width": 640,
          "height": 360
        },
        "display": {
          "path": "assets/manuals/build-a-graphics-regression-test-scene/display.webp",
          "width": 1280,
          "height": 720
        }
      },
      "rights": {
        "creator": "PCSX2 Team and website contributors",
        "sourceUrl": "https://github.com/PCSX2/pcsx2-net-www/blob/main/docs/troubleshooting/img/bisect.webp",
        "licenseId": "MIT",
        "licenseUrl": "https://github.com/PCSX2/pcsx2-net-www/blob/main/LICENSE",
        "attribution": "docs/troubleshooting/img/bisect.webp by PCSX2 website contributors, used under the MIT License. Cropped, resized, and converted to WebP for EmuCore - Hub.",
        "modified": true,
        "downloadAllowed": true
      }
    }
  ]
}
