{
  "schemaVersion": 1,
  "id": "test-ps2-audio-with-android-sound-enhancements-disabled",
  "type": "manuals",
  "contentVersion": 1,
  "status": "published",
  "publishedAt": "2026-08-09T00:00:00Z",
  "updatedAt": "2026-08-09T00:00:00Z",
  "categories": [
    "emucorex",
    "audio-display",
    "audio"
  ],
  "tags": [
    "sound-enhancements",
    "equalizer",
    "spatial-audio",
    "audio-test"
  ],
  "relatedProductIds": [
    "emucorex",
    "pcsx2"
  ],
  "featured": false,
  "priority": 0,
  "canonicalUrl": "https://developer.android.com/reference/android/media/AudioRouting",
  "sources": [
    {
      "id": "android-audio-routing",
      "title": "Audio routing",
      "publisher": "Android Developers",
      "url": "https://developer.android.com/reference/android/media/AudioRouting"
    },
    {
      "id": "android-low-latency-audio",
      "title": "Low latency audio",
      "publisher": "Android Developers",
      "url": "https://developer.android.com/games/sdk/oboe/low-latency-audio"
    }
  ],
  "heroAssetId": "test-ps2-audio-with-android-sound-enhancements-disabled-hero",
  "assets": [
    {
      "assetId": "test-ps2-audio-with-android-sound-enhancements-disabled-hero",
      "variants": {
        "thumbnail": {
          "path": "assets/manuals/test-ps2-audio-with-android-sound-enhancements-disabled/thumbnail.webp",
          "width": 640,
          "height": 360
        },
        "display": {
          "path": "assets/manuals/test-ps2-audio-with-android-sound-enhancements-disabled/display.webp",
          "width": 1280,
          "height": 720
        }
      },
      "rights": {
        "creator": "PCSX2 Team and website contributors",
        "sourceUrl": "https://github.com/PCSX2/pcsx2-net-www/blob/main/blog/2025/pcsx2-2.6/img/comparisons/13505-TombRaider-After.webp",
        "licenseId": "MIT",
        "licenseUrl": "https://github.com/PCSX2/pcsx2-net-www/blob/main/LICENSE",
        "attribution": "blog/2025/pcsx2-2.6/img/comparisons/13505-TombRaider-After.webp by PCSX2 website contributors, used under the MIT License. Cropped, resized, and converted to WebP for EmuCore - Hub.",
        "modified": true,
        "downloadAllowed": true
      }
    }
  ]
}
