{
  "schemaVersion": 1,
  "id": "yt-slhqqtnngw4",
  "type": "videos",
  "contentVersion": 1,
  "status": "published",
  "publishedAt": "2025-04-13T12:00:00Z",
  "updatedAt": "2025-04-13T12:00:00Z",
  "categories": [
    "guides",
    "android"
  ],
  "tags": [
    "Android",
    "PlayStation 2",
    "PS2 emulation",
    "AetherSX2",
    "NetherSX2"
  ],
  "relatedProductIds": [
    "playstation-2",
    "aethersx2",
    "nethersx2"
  ],
  "canonicalUrl": "https://www.youtube.com/watch?v=slHQqTNNGW4",
  "sources": [
    {
      "id": "youtube",
      "title": "New NetherSX2 Emulator on Any Android Phone - Setup & Best Settings",
      "publisher": "PRO WARRIORS",
      "url": "https://www.youtube.com/watch?v=slHQqTNNGW4",
      "accessedAt": "2026-08-08"
    }
  ],
  "assets": [],
  "provider": "youtube",
  "providerId": "slHQqTNNGW4",
  "channelTitle": "PRO WARRIORS",
  "sourceLanguage": "en",
  "featured": false,
  "priority": 10
}
