{
  "schemaVersion": 1,
  "id": "diagnose-a-renderer-crash-during-shader-compilation",
  "type": "manuals",
  "contentVersion": 1,
  "status": "published",
  "publishedAt": "2026-08-09T00:00:00Z",
  "updatedAt": "2026-08-09T00:00:00Z",
  "categories": [
    "emucorex",
    "graphics",
    "crash"
  ],
  "tags": [
    "shader-compilation",
    "renderer-crash",
    "gpu-driver",
    "cache"
  ],
  "relatedProductIds": [
    "emucorex",
    "pcsx2"
  ],
  "featured": false,
  "priority": 0,
  "canonicalUrl": "https://pcsx2.net/docs/troubleshooting/windows/",
  "sources": [
    {
      "id": "pcsx2-windows",
      "title": "Windows Issues",
      "publisher": "PCSX2",
      "url": "https://pcsx2.net/docs/troubleshooting/windows/"
    },
    {
      "id": "pcsx2-vulkan",
      "title": "Q1 2022 Progress Report",
      "publisher": "PCSX2",
      "url": "https://pcsx2.net/blog/2023/q1-2022-progress-report/"
    }
  ],
  "heroAssetId": "diagnose-a-renderer-crash-during-shader-compilation-hero",
  "assets": [
    {
      "assetId": "diagnose-a-renderer-crash-during-shader-compilation-hero",
      "variants": {
        "thumbnail": {
          "path": "assets/manuals/diagnose-a-renderer-crash-during-shader-compilation/thumbnail.webp",
          "width": 640,
          "height": 360
        },
        "display": {
          "path": "assets/manuals/diagnose-a-renderer-crash-during-shader-compilation/display.webp",
          "width": 1280,
          "height": 720
        }
      },
      "rights": {
        "creator": "PCSX2 Team and website contributors",
        "sourceUrl": "https://github.com/PCSX2/pcsx2-net-www/blob/main/docs/troubleshooting/img/old_driver.webp",
        "licenseId": "MIT",
        "licenseUrl": "https://github.com/PCSX2/pcsx2-net-www/blob/main/LICENSE",
        "attribution": "docs/troubleshooting/img/old_driver.webp by PCSX2 website contributors, used under the MIT License. Cropped, resized, and converted to WebP for EmuCore - Hub.",
        "modified": true,
        "downloadAllowed": true
      }
    }
  ]
}
