{
  "schemaVersion": 1,
  "id": "dragon-quest-viii-cel-world-localization",
  "type": "history",
  "contentVersion": 1,
  "status": "published",
  "publishedAt": "2004-01-01T00:00:00Z",
  "updatedAt": "2026-08-09T00:00:00Z",
  "eventDate": "2004",
  "datePrecision": "year",
  "categories": [
    "ps2-history",
    "ps2-games"
  ],
  "tags": [
    "playstation-2",
    "studio-pipelines-and-authored-production"
  ],
  "relatedProductIds": [
    "ps2"
  ],
  "featured": false,
  "priority": 5,
  "canonicalUrl": "https://en.wikipedia.org/wiki/Dragon_Quest_VIII",
  "sources": [
    {
      "id": "overview",
      "title": "Dragon Quest VIII",
      "publisher": "Wikipedia contributors",
      "url": "https://en.wikipedia.org/wiki/Dragon_Quest_VIII"
    },
    {
      "id": "release-announcement",
      "title": "Dragon Quest VIII to Be Released in Japan November 27, 2004",
      "publisher": "Square Enix",
      "url": "https://www.jp.square-enix.com/company/en/news/2004/download/0302-200409220000-02.pdf"
    },
    {
      "id": "period-review",
      "title": "Dragon Quest VIII Review",
      "publisher": "RPGamer",
      "url": "https://rpgamer.com/review/dragon-quest-viii-journey-of-the-cursed-king-review-ps2/"
    },
    {
      "id": "credits",
      "title": "Dragon Quest VIII credits",
      "publisher": "MobyGames",
      "url": "https://www.mobygames.com/game/20450/dragon-quest-viii-journey-of-the-cursed-king/credits/ps2/"
    },
    {
      "id": "horii-interview",
      "title": "25 Years of Dragon Quest: An Interview with Yuji Horii",
      "publisher": "Game Developer",
      "url": "https://www.gamedeveloper.com/business/25-years-of-i-dragon-quest-i-an-interview-with-yuji-horii"
    }
  ],
  "heroAssetId": "dragon-quest-viii-cel-world-localization-hero",
  "assets": [
    {
      "assetId": "dragon-quest-viii-cel-world-localization-hero",
      "variants": {
        "thumbnail": {
          "path": "assets/history/dragon-quest-viii-cel-world-localization/thumbnail.webp",
          "width": 640,
          "height": 360
        },
        "display": {
          "path": "assets/history/dragon-quest-viii-cel-world-localization/display.webp",
          "width": 1280,
          "height": 720
        }
      },
      "rights": {
        "creator": "tenaciousme",
        "sourceUrl": "https://commons.wikimedia.org/wiki/File:Dragon_Quest_cosplay_TGS_2007.jpg",
        "licenseId": "CC BY 2.0",
        "licenseUrl": "https://creativecommons.org/licenses/by/2.0",
        "attribution": "tenaciousme, CC BY 2.0. Cropped, resized and converted to WebP for EmuCore - Hub.",
        "modified": true,
        "downloadAllowed": true
      }
    }
  ]
}
